[
  {
    "schema_version": "1.1",
    "criterion_id": "PA-AC-001",
    "name": "Readable CSV",
    "description": "Result CSV is readable.",
    "category": "output",
    "check_mode": "DETERMINISTIC",
    "severity": "BLOCKER",
    "target": {
      "scope": "ARTIFACT",
      "dataset_id": null,
      "column": null,
      "columns": null,
      "artifact_type": "RESULT_CSV",
      "metric": null
    },
    "operator": "readable",
    "expected": true,
    "tolerance": null,
    "source": "client_answer",
    "requirement_status": "CONFIRMED"
  },
  {
    "schema_version": "1.1",
    "criterion_id": "PA-AC-002",
    "name": "Exact columns",
    "description": "Internal schema has exactly the agreed ordered technical columns; export headers are the corresponding output_name values.",
    "category": "schema",
    "check_mode": "DETERMINISTIC",
    "severity": "BLOCKER",
    "target": {
      "scope": "COLUMNS",
      "dataset_id": "result",
      "column": null,
      "columns": [
        "customer_name",
        "country",
        "signup_date",
        "revenue",
        "status",
        "email"
      ],
      "artifact_type": null,
      "metric": null
    },
    "operator": "sequence_equals",
    "expected": [
      "customer_name",
      "country",
      "signup_date",
      "revenue",
      "status",
      "email"
    ],
    "tolerance": null,
    "source": "client_answer",
    "requirement_status": "CONFIRMED"
  },
  {
    "schema_version": "1.1",
    "criterion_id": "PA-AC-003",
    "name": "Exact rows",
    "description": "Exactly three rows.",
    "category": "volume",
    "check_mode": "DETERMINISTIC",
    "severity": "ERROR",
    "target": {
      "scope": "METRIC",
      "dataset_id": "result",
      "column": null,
      "columns": null,
      "artifact_type": null,
      "metric": "row_count"
    },
    "operator": "exact_count",
    "expected": 3,
    "tolerance": null,
    "source": "client_answer",
    "requirement_status": "CONFIRMED"
  },
  {
    "schema_version": "1.1",
    "criterion_id": "PA-AC-004",
    "name": "Required names",
    "description": "No missing customer_name.",
    "category": "completeness",
    "check_mode": "DETERMINISTIC",
    "severity": "BLOCKER",
    "target": {
      "scope": "COLUMN",
      "dataset_id": "result",
      "column": "customer_name",
      "columns": null,
      "artifact_type": null,
      "metric": null
    },
    "operator": "all_non_null",
    "expected": true,
    "tolerance": null,
    "source": "client_answer",
    "requirement_status": "CONFIRMED"
  },
  {
    "schema_version": "1.1",
    "criterion_id": "PA-AC-005",
    "name": "Unique email",
    "description": "Email is unique.",
    "category": "uniqueness",
    "check_mode": "DETERMINISTIC",
    "severity": "BLOCKER",
    "target": {
      "scope": "COLUMN",
      "dataset_id": "result",
      "column": "email",
      "columns": null,
      "artifact_type": null,
      "metric": null
    },
    "operator": "unique",
    "expected": true,
    "tolerance": null,
    "source": "client_answer",
    "requirement_status": "CONFIRMED"
  },
  {
    "schema_version": "1.1",
    "criterion_id": "PA-AC-006",
    "name": "Date format",
    "description": "Date is YYYY-MM-DD.",
    "category": "format",
    "check_mode": "DETERMINISTIC",
    "severity": "ERROR",
    "target": {
      "scope": "COLUMN",
      "dataset_id": "result",
      "column": "signup_date",
      "columns": null,
      "artifact_type": null,
      "metric": null
    },
    "operator": "matches_format",
    "expected": "YYYY-MM-DD",
    "tolerance": null,
    "source": "client_answer",
    "requirement_status": "CONFIRMED"
  },
  {
    "schema_version": "1.1",
    "criterion_id": "PA-AC-007",
    "name": "Revenue range",
    "description": "Revenue is non-negative.",
    "category": "range",
    "check_mode": "DETERMINISTIC",
    "severity": "ERROR",
    "target": {
      "scope": "COLUMN",
      "dataset_id": "result",
      "column": "revenue",
      "columns": null,
      "artifact_type": null,
      "metric": null
    },
    "operator": "min_value",
    "expected": 0,
    "tolerance": null,
    "source": "client_answer",
    "requirement_status": "CONFIRMED"
  }
]
